{
  "schemaId": "current-platform-release-v1",
  "manifestType": "current-platform-release",
  "platformReleaseId": "rsc-current-platform-r1",
  "platformGeneration": 1,
  "platformApiVersion": "current-extension-api-v1",
  "extensionApi": {
    "apiId": "current-extension-api-v1",
    "allowedModuleNamespaceRoot": "org.rscworld.modules",
    "forbiddenClassPrefixes": [
      "com/openrsc/",
      "orsc/",
      "org/apache/",
      "com/google/"
    ],
    "classShadowPolicy": "forbid"
  },
  "protocol": {
    "handshakeId": "current-composition-handshake-v1",
    "mismatchPolicy": "refuse-startup",
    "identityFields": [
      "platformReleaseId",
      "platformManifestHash",
      "variantId",
      "variantManifestHash",
      "moduleSetHash",
      "bundleInventoryHash"
    ]
  },
  "schemaContracts": [
    {
      "schemaId": "current-base-client-content-v1",
      "relativePath": "schema/current-base-client-content-v1.schema.json",
      "sha256": "2ea3d743dcbbf4aea3f70375081db267f3b700c8d0cd2d9b61cc3bd52c0df66e"
    },
    {
      "schemaId": "current-base-installed-execution-evidence-v1",
      "relativePath": "schema/current-base-installed-execution-evidence-v1.schema.json",
      "sha256": "dbe9a2194eb390b79fe9306fa857a996041e2f1cfc79ef4d9b0a7741485a5c4f"
    },
    {
      "schemaId": "current-base-installed-execution-v1",
      "relativePath": "schema/current-base-installed-execution-v1.schema.json",
      "sha256": "387104da2719e2284dead6803bfe24516ce241f3648553e006519da86baa9fab"
    },
    {
      "schemaId": "current-base-runtime-profile-v1",
      "relativePath": "schema/current-base-runtime-profile-v1.schema.json",
      "sha256": "188e01b63cfbb2973564d7bbd5185caa96a45482b627cc0585d2b852e74a4d7a"
    },
    {
      "schemaId": "current-base-server-content-v1",
      "relativePath": "schema/current-base-server-content-v1.schema.json",
      "sha256": "bd5de7f942a7249e6a15a1bf33c8d4d890cddb7ea69ad4cb053c373bdb566432"
    },
    {
      "schemaId": "current-base-state-migration-v1",
      "relativePath": "schema/current-base-state-migration-v1.schema.json",
      "sha256": "633decbee1676c1b0a1cf15e07ee3d14c02c7436571fd79eaebb8dcd0789245c"
    },
    {
      "schemaId": "current-bundle-spec-v1",
      "relativePath": "schema/current-bundle-spec-v1.schema.json",
      "sha256": "8cf8d090244b4b60fbe547ce10879fc5d5705bb59a24f23c1908b22dadc1e950"
    },
    {
      "schemaId": "current-composition-identity-v1",
      "relativePath": "schema/current-composition-identity-v1.schema.json",
      "sha256": "5b68999e17092c534c147e67bb8a9cd4c77403da61c22ba25dde034638fa05d8"
    },
    {
      "schemaId": "current-module-v1",
      "relativePath": "schema/current-module-v1.schema.json",
      "sha256": "0a02df1fdd2b0cc65aed1b317022f93682f8fa964c3839281cf2995313cfd65b"
    },
    {
      "schemaId": "current-platform-release-v1",
      "relativePath": "schema/current-platform-release-v1.schema.json",
      "sha256": "9c3d1898a70379f2f709091341e2d904468fe4bc26be1dd3195714ae9844a663"
    },
    {
      "schemaId": "current-preservation-r64-input-adapter-v1",
      "relativePath": "schema/current-preservation-r64-input-adapter-v1.schema.json",
      "sha256": "6f70a4b6b52534ef648722b9dc5f59c000f5fb76e00d87d2f7abfea9c3405b39"
    },
    {
      "schemaId": "current-variant-v1",
      "relativePath": "schema/current-variant-v1.schema.json",
      "sha256": "35151dfd3e15cf202d49abf34cc2b74220b6d94bee45bdf443ce61d10d19b6aa"
    }
  ],
  "mapRuntimeCapabilities": [
    "canonical-signed-layered-map-v1",
    "all-placement-families-v4",
    "wide-elevation-u16-v2",
    "transactional-map-activation-v1"
  ],
  "inputAdapterBoundary": {
    "contractId": "world-builder-input-adapter-v1",
    "installedInRuntime": false,
    "selectionAuthority": "editor-migration-boundary-only",
    "unknownCodePolicy": "refuse-before-mutation"
  },
  "bundleContract": {
    "schemaId": "current-bundle-spec-v1",
    "closedInventoryRequired": true,
    "artifactHashAlgorithm": "sha256",
    "sourceAuthority": "selected-current-composition-source",
    "receiptBuildAuthority": "never",
    "targetOverlayPolicy": "replace-complete-runtime-no-class-overlay",
    "activationLayout": "side-by-side-content-addressed"
  },
  "provenance": {
    "repository": "rsc-world-editor-runtime",
    "authority": "provider-commit",
    "historicalTargetCodeAllowed": false
  }
}
